{
  "$schema": "../recipe.schema.json",
  "schemaVersion": 1,
  "number": 120,
  "status": "draft",
  "chapter": "page",
  "order": 160,
  "level": 2,
  "genres": ["ephemera"],
  "outputs": ["canvas", "pdf"],
  "features": {
    "primary": ["character-grid", "japanese-kinsoku", "yakumono"],
    "also": ["vertical-writing", "right-binding", "gyodori-headings", "kana-scripts", "cjk-fonts", "aozora-import", "paragraph-styles", "design-elements", "running-heads", "page-background", "color-palette", "pdf-export"]
  },
  "answers": ["Q90", "Q136"],
  "gotchas": ["ja-locale-tag", "headings-drop-h1-break", "cjk-fonts-slices", "cjk-grid-balancing", "vertical-two-frames"],
  "related": ["chinese-official-document", "bunko-novel-furigana", "woodblock-leaf", "chinese-novel-horizontal"],
  "engine": { "postext": "1.16.1", "postextPdf": "1.16.1" },
  "kit": ["core", "fonts", "viewer", "pdf", "cjk"],
  "sample": { "locales": ["en", "es"] },
  "capture": { "hero": 1, "card": "page", "pages": "all" },
  "downloads": { "pdf": true },
  "credits": {
    "authors": [{ "name": "Ignacio Ferro", "github": "drnachio" }],
    "text": [
      {
        "what": {
          "en": "夏目漱石『坊っちゃん』 (Botchan, 1906), the first three paragraphs, without the readings; Aozora Bunko card 752, from 「ちくま日本文学全集　夏目漱石」 (Chikuma Shobō, 1992), input 真先芳秋, proofreading 柳沢成雄, converted with aozora.py",
          "es": "夏目漱石『坊っちゃん』 (Botchan, 1906), los tres primeros párrafos, sin las lecturas; ficha 752 de Aozora Bunko, según 「ちくま日本文学全集　夏目漱石」 (Chikuma Shobō, 1992), transcripción de 真先芳秋, corrección de 柳沢成雄, convertida con aozora.py"
        },
        "who": "Natsume Sōseki; Aozora Bunko volunteers",
        "source": "https://www.aozora.gr.jp/cards/000148/card752.html",
        "license": "PD"
      }
    ],
    "images": [],
    "fonts": [
      { "family": "Klee One", "license": "OFL-1.1" },
      { "family": "Noto Sans JP", "license": "OFL-1.1" }
    ]
  },
  "license": { "code": "MIT", "content": "CC-BY-4.0" },
  "created": "2026-10-05",
  "updated": "2026-10-05"
}
